{
  "schema_version": 1,
  "catalog_version": "AETHER-CATALOG-20261010.3",
  "source_sha256": "3ef9a267bda4fd2c89b2b9b48658da985680003da98a767a69e4d6e95304873d",
  "source_spec_count": 88,
  "cases": [
    {
      "id": "ENV-01",
      "title": "候选版本与证据身份冻结",
      "requirements": [
        "NFR-BASE"
      ],
      "stage": "MVP",
      "level": "发布前置",
      "priority": "P0",
      "dataset": "无",
      "preconditions": "只读发布清单/运行身份可用",
      "steps": [
        "记录Git SHA及dirty标记、镜像digest、配置/模型/tokenizer版本",
        "采集实际Pod与API版本",
        "对比发布清单并冻结run_id"
      ],
      "expected": [
        "Git、镜像和实际部署映射一致；不以拉取最新代替已部署",
        "不一致阻塞版本验收，允许另标exploratory诊断"
      ],
      "api_group": "runtime",
      "smoke": true,
      "cleanup": "保留失败对象与证据；通过对象按run_id清单清理；撤销本用例Grant/故障开关，核对无在途写。",
      "evidence": "按E0—E6模板保存；本用例每步step_id与operation/task/trace关联。",
      "automation": [],
      "design_state": "SPECIFIED",
      "open_design_items": [
        "按固定候选版本展开数据、参数及判定边界；本规格尚未完成全量自动化验收。"
      ],
      "required_capabilities": [
        "candidate_identity",
        "real_test_data"
      ],
      "always_select": false
    },
    {
      "id": "ENV-02",
      "title": "真实依赖与能力预检",
      "requirements": [
        "NFR-BASE",
        "FR18"
      ],
      "stage": "MVP",
      "level": "集成",
      "priority": "P0",
      "dataset": "D02",
      "preconditions": "测试隔离环境；真实PG/Ceph/Milvus/Redis/Temporal及模型",
      "steps": [
        "读live/ready/capabilities和健康状态",
        "以唯一对象验证真实保存、向量计算、读取",
        "记录依赖身份和允许能力"
      ],
      "expected": [
        "健康、能力、实际访问一致",
        "模拟/lexical替代不得记real；独立能力故障显示受影响范围"
      ],
      "api_group": "runtime",
      "smoke": true,
      "cleanup": "保留失败对象与证据；通过对象按run_id清单清理；撤销本用例Grant/故障开关，核对无在途写。",
      "evidence": "按E0—E6模板保存；本用例每步step_id与operation/task/trace关联。",
      "automation": [
        {
          "path": "scripts/quality/apifox_journeys.py",
          "scenario_keys": [
            "internal-chain"
          ],
          "coverage": "partial",
          "dependency": "real"
        }
      ],
      "design_state": "PARTIALLY_AUTOMATED",
      "open_design_items": [
        "按固定候选版本展开数据、参数及判定边界；本规格尚未完成全量自动化验收。"
      ],
      "required_capabilities": [
        "candidate_identity",
        "real_test_data"
      ],
      "always_select": false
    },
    {
      "id": "ENV-03",
      "title": "隔离租户与污染控制",
      "requirements": [
        "FR15",
        "TEN-02"
      ],
      "stage": "MVP",
      "level": "发布前置",
      "priority": "P0",
      "dataset": "D02",
      "preconditions": "A/B专用测试租户及A1/A2/B1账号",
      "steps": [
        "登记所有账号的可信租户与权限",
        "新建case级scope和来源ID",
        "导入前限定scope查询目标事实"
      ],
      "expected": [
        "无历史测试数据污染；零命中对照可复核",
        "无需删除演示用户原数据；不同用例互不依赖"
      ],
      "api_group": "auth",
      "smoke": true,
      "cleanup": "保留失败对象与证据；通过对象按run_id清单清理；撤销本用例Grant/故障开关，核对无在途写。",
      "evidence": "按E0—E6模板保存；本用例每步step_id与operation/task/trace关联。",
      "automation": [],
      "design_state": "SPECIFIED",
      "open_design_items": [
        "按固定候选版本展开数据、参数及判定边界；本规格尚未完成全量自动化验收。"
      ],
      "required_capabilities": [
        "candidate_identity",
        "real_test_data"
      ],
      "always_select": false
    },
    {
      "id": "ENV-04",
      "title": "真实数据与标准答案冻结",
      "requirements": [
        "NFR-DATA"
      ],
      "stage": "MVP",
      "level": "发布前置",
      "priority": "P0",
      "dataset": "D01—D05及派生",
      "preconditions": "数据清单与来源可访问",
      "steps": [
        "校验原件及派生字节SHA256",
        "按源文件重算气象/农业指标",
        "独立审阅关系、否定及引用答案"
      ],
      "expected": [
        "哈希与版本一致；数值独立于模型输出生成",
        "来源/答案变动必须升级fixture版本，旧结果不覆盖"
      ],
      "api_group": "documents",
      "smoke": true,
      "cleanup": "保留失败对象与证据；通过对象按run_id清单清理；撤销本用例Grant/故障开关，核对无在途写。",
      "evidence": "按E0—E6模板保存；本用例每步step_id与operation/task/trace关联。",
      "automation": [],
      "design_state": "SPECIFIED",
      "open_design_items": [
        "按固定候选版本展开数据、参数及判定边界；本规格尚未完成全量自动化验收。"
      ],
      "required_capabilities": [
        "candidate_identity",
        "real_test_data"
      ],
      "always_select": false
    },
    {
      "id": "ENV-05",
      "title": "追踪、计时与凭证脱敏预检",
      "requirements": [
        "NFR-OBS"
      ],
      "stage": "MVP",
      "level": "集成",
      "priority": "P0",
      "dataset": "D02",
      "preconditions": "只读日志和证据目录可用",
      "steps": [
        "执行一条带correlation的真实业务请求",
        "串联API、任务、Temporal、节点和回读",
        "测试日志导出失败及脱敏"
      ],
      "expected": [
        "能关联本轮对象及各阶段时间",
        "日志不含令牌/密码；缺span标unknown，导出失败不改变业务成功事实"
      ],
      "api_group": "observability",
      "smoke": false,
      "cleanup": "保留失败对象与证据；通过对象按run_id清单清理；撤销本用例Grant/故障开关，核对无在途写。",
      "evidence": "按E0—E6模板保存；本用例每步step_id与operation/task/trace关联。",
      "automation": [],
      "design_state": "SPECIFIED",
      "open_design_items": [
        "按固定候选版本展开数据、参数及判定边界；本规格尚未完成全量自动化验收。"
      ],
      "required_capabilities": [
        "candidate_identity",
        "real_test_data"
      ],
      "always_select": false
    },
    {
      "id": "ENV-06",
      "title": "接口差异与参数决策闭合",
      "requirements": [
        "NFR-BASE"
      ],
      "stage": "MVP",
      "level": "发布前置",
      "priority": "P0",
      "dataset": "无",
      "preconditions": "目标公开文档与负责人可确认",
      "steps": [
        "导出P3及平台API/版本并与快照diff",
        "确认权限、错误码、大小限制、性能边界和待决项",
        "为新增/删除操作修订映射"
      ],
      "expected": [
        "81项只是10/8快照；新增操作不得遗漏",
        "未确定断言/参数不执行正式门禁；旧enforce_now=false不能豁免本轮验收"
      ],
      "api_group": "runtime",
      "smoke": true,
      "cleanup": "保留失败对象与证据；通过对象按run_id清单清理；撤销本用例Grant/故障开关，核对无在途写。",
      "evidence": "按E0—E6模板保存；本用例每步step_id与operation/task/trace关联。",
      "automation": [],
      "design_state": "SPECIFIED",
      "open_design_items": [
        "按固定候选版本展开数据、参数及判定边界；本规格尚未完成全量自动化验收。"
      ],
      "required_capabilities": [
        "candidate_identity",
        "real_test_data"
      ],
      "always_select": false
    },
    {
      "id": "CT-01",
      "title": "合法请求与响应契约",
      "requirements": [
        "NFR-API"
      ],
      "stage": "MVP",
      "level": "接口契约",
      "priority": "P0",
      "dataset": "按各功能用例",
      "preconditions": "ENV-01—06完成；操作×参数实例展开后分别登记",
      "steps": [
        "按业务用例创建有效对象",
        "调用每个已发布操作",
        "校验响应Schema、字段/类型/状态和业务回读"
      ],
      "expected": [
        "响应符合已冻结契约；异步受理只判断接收",
        "业务通过另由对应功能用例判定"
      ],
      "api_group": "all",
      "smoke": false,
      "cleanup": "保留失败对象与证据；通过对象按run_id清单清理；撤销本用例Grant/故障开关，核对无在途写。",
      "evidence": "按E0—E6模板保存；本用例每步step_id与operation/task/trace关联。",
      "automation": [],
      "design_state": "SPECIFIED",
      "open_design_items": [
        "按固定候选版本展开数据、参数及判定边界；本规格尚未完成全量自动化验收。"
      ],
      "required_capabilities": [
        "candidate_identity",
        "real_test_data"
      ],
      "always_select": false
    },
    {
      "id": "CT-02",
      "title": "鉴权及对象权限参数矩阵",
      "requirements": [
        "NFR-API"
      ],
      "stage": "MVP",
      "level": "接口契约",
      "priority": "P0",
      "dataset": "按各功能用例",
      "preconditions": "ENV-01—06完成；操作×参数实例展开后分别登记",
      "steps": [
        "先用有权身份执行控制请求",
        "依次无凭证/过期/同租户无权/跨租户调用",
        "检查正文、元数据与副作用"
      ],
      "expected": [
        "公共入口按发布访问策略；受保护入口按错误码表拒绝",
        "有权对照成功，无权不泄露对象存在性或产生效果"
      ],
      "api_group": "all",
      "smoke": false,
      "cleanup": "保留失败对象与证据；通过对象按run_id清单清理；撤销本用例Grant/故障开关，核对无在途写。",
      "evidence": "按E0—E6模板保存；本用例每步step_id与operation/task/trace关联。",
      "automation": [
        {
          "path": "scripts/quality/apifox_journeys.py",
          "scenario_keys": [
            "identity-forged-claims"
          ],
          "coverage": "partial",
          "dependency": "real"
        }
      ],
      "design_state": "PARTIALLY_AUTOMATED",
      "open_design_items": [
        "按固定候选版本展开数据、参数及判定边界；本规格尚未完成全量自动化验收。"
      ],
      "required_capabilities": [
        "candidate_identity",
        "real_test_data"
      ],
      "always_select": false
    },
    {
      "id": "CT-03",
      "title": "字段边界与非法输入矩阵",
      "requirements": [
        "NFR-API"
      ],
      "stage": "MVP",
      "level": "接口契约",
      "priority": "P0",
      "dataset": "按各功能用例",
      "preconditions": "ENV-01—06完成；操作×参数实例展开后分别登记",
      "steps": [
        "从OpenAPI提取required/enum/min/max及条件分支",
        "对每字段做缺失/null/错型/边界内外和未知字段",
        "核对错误及业务存储"
      ],
      "expected": [
        "合法边界接受；非法输入按冻结错误码拒绝",
        "不把500或静默丢字段算正确；失败请求不产生新效果"
      ],
      "api_group": "all",
      "smoke": false,
      "cleanup": "保留失败对象与证据；通过对象按run_id清单清理；撤销本用例Grant/故障开关，核对无在途写。",
      "evidence": "按E0—E6模板保存；本用例每步step_id与operation/task/trace关联。",
      "automation": [
        {
          "path": "scripts/quality/apifox_journeys.py",
          "scenario_keys": [
            "identity-input-boundaries"
          ],
          "coverage": "partial",
          "dependency": "real"
        }
      ],
      "design_state": "PARTIALLY_AUTOMATED",
      "open_design_items": [
        "按固定候选版本展开数据、参数及判定边界；本规格尚未完成全量自动化验收。"
      ],
      "required_capabilities": [
        "candidate_identity",
        "real_test_data"
      ],
      "always_select": false
    },
    {
      "id": "CT-04",
      "title": "重放、查询与并发语义",
      "requirements": [
        "NFR-API"
      ],
      "stage": "MVP",
      "level": "接口契约",
      "priority": "P0",
      "dataset": "按各功能用例",
      "preconditions": "ENV-01—06完成；操作×参数实例展开后分别登记",
      "steps": [
        "区分只读/写入/幂等ID/版本CAS操作",
        "只读重复查询；写入同ID同输入和不同输入",
        "并发提交并核对唯一正式效果"
      ],
      "expected": [
        "只读不得偷偷启动新任务；幂等冲突/版本冲突按契约",
        "不适用子项逐一N/A有理由；未知写结果先查原ID"
      ],
      "api_group": "all",
      "smoke": false,
      "cleanup": "保留失败对象与证据；通过对象按run_id清单清理；撤销本用例Grant/故障开关，核对无在途写。",
      "evidence": "按E0—E6模板保存；本用例每步step_id与operation/task/trace关联。",
      "automation": [],